{
  "id": "urn:mrr:evidence-matrix:01J00000000000000000000107",
  "api_version": "mrr/v1alpha1",
  "kind": "EvidenceMatrix",
  "practice_id": "urn:mrr:practice:01J00000000000000000000001",
  "revision": 1,
  "created_at": "2026-07-21T10:00:00Z",
  "created_by": "urn:mrr:person:01J00000000000000000000002",
  "content_hash": "sha256:7777777777777777777777777777777777777777777777777777777777777777",
  "project_id": "urn:mrr:project:01J00000000000000000000100",
  "search_strategy_revision": "synthetic-reference/1",
  "records": [],
  "status": "draft"
}
